{"as_of":"2026-10-17","chcs":[{"chc_id":"CHC-1","name":"Depot North (simulated)","lon":-93.505,"lat":42.062,"machines":6},{"chc_id":"CHC-2","name":"Depot Central (simulated)","lon":-93.468,"lat":42.027,"machines":9},{"chc_id":"CHC-3","name":"Depot South-East (simulated)","lon":-93.432,"lat":41.992,"machines":5}],"plan":[],"summary":{"ha_demand":40.6,"optimized":{"ha_served_in_window":0.0,"ha_missed_window":40.6,"pct_served":0.0,"machine_days":0,"travel_km":0},"baseline":{"ha_served_in_window":40.6,"ha_missed_window":0.0,"pct_served":100.0,"machine_days":40,"travel_km":25267.8},"greedy":{"ha_served_in_window":0.0,"ha_missed_window":40.6,"pct_served":0.0,"machine_days":0,"travel_km":0},"milp":{"ha_served_in_window":0.0,"ha_missed_window":40.6,"pct_served":0.0,"machine_days":0,"travel_km":0},"method":"milp","solver":{"n_jobs":80,"n_jobs_merged":45,"n_int_vars":0,"n_cont_vars":619,"time_limit_s":10.0,"status":"nothing to dispatch","optimal":true,"solve_s":0.0,"n_constraints":0,"mip_gap":0.0,"assign_status":"nothing to assign"},"notes":"ha = machine-dependent area (field area x share_needing_chc). optimized = the plan above (milp); greedy = earliest-deadline-first heuristic, milp = exact solver (scipy/HiGHS), both pool CHCs within max_service_km and know demand in advance. Baseline = reactive booking: request after harvest + lag, nearest CHC only, first come first served. CHCs are simulated."}}