{"as_of":"2026-10-17","chcs":[{"chc_id":"CHC-1","name":"Depot North (simulated)","lon":-93.505,"lat":42.062,"machines":6},{"chc_id":"CHC-2","name":"Depot Central (simulated)","lon":-93.468,"lat":42.027,"machines":9},{"chc_id":"CHC-3","name":"Depot South-East (simulated)","lon":-93.432,"lat":41.992,"machines":5}],"plan":[{"date":"2026-10-17","chc_id":"CHC-1","zone_id":"Z01","machines":1,"ha":31.0},{"date":"2026-10-17","chc_id":"CHC-2","zone_id":"Z06","machines":1,"ha":24.4},{"date":"2026-10-17","chc_id":"CHC-2","zone_id":"Z07","machines":1,"ha":16.4},{"date":"2026-10-18","chc_id":"CHC-1","zone_id":"Z02","machines":1,"ha":40.0},{"date":"2026-10-18","chc_id":"CHC-2","zone_id":"Z03","machines":1,"ha":40.0},{"date":"2026-10-18","chc_id":"CHC-2","zone_id":"Z04","machines":1,"ha":7.1},{"date":"2026-10-18","chc_id":"CHC-2","zone_id":"Z05","machines":1,"ha":32.2},{"date":"2026-10-18","chc_id":"CHC-2","zone_id":"Z06","machines":1,"ha":26.6},{"date":"2026-10-19","chc_id":"CHC-3","zone_id":"Z08","machines":1,"ha":26.4},{"date":"2026-10-19","chc_id":"CHC-3","zone_id":"Z09","machines":1,"ha":2.3},{"date":"2026-10-20","chc_id":"CHC-2","zone_id":"Z04","machines":1,"ha":28.9},{"date":"2026-10-20","chc_id":"CHC-2","zone_id":"Z07","machines":1,"ha":37.2},{"date":"2026-10-21","chc_id":"CHC-3","zone_id":"Z09","machines":1,"ha":15.2},{"date":"2026-10-23","chc_id":"CHC-1","zone_id":"Z01","machines":1,"ha":7.9},{"date":"2026-10-24","chc_id":"CHC-2","zone_id":"Z07","machines":1,"ha":5.1},{"date":"2026-10-24","chc_id":"CHC-3","zone_id":"Z09","machines":1,"ha":24.8},{"date":"2026-10-25","chc_id":"CHC-1","zone_id":"Z01","machines":1,"ha":4.1},{"date":"2026-10-25","chc_id":"CHC-1","zone_id":"Z02","machines":1,"ha":16.8},{"date":"2026-10-25","chc_id":"CHC-2","zone_id":"Z07","machines":1,"ha":32.0},{"date":"2026-10-26","chc_id":"CHC-1","zone_id":"Z01","machines":1,"ha":25.8},{"date":"2026-10-26","chc_id":"CHC-2","zone_id":"Z05","machines":1,"ha":15.3},{"date":"2026-10-27","chc_id":"CHC-2","zone_id":"Z05","machines":1,"ha":1.2},{"date":"2026-10-28","chc_id":"CHC-1","zone_id":"Z01","machines":1,"ha":10.6},{"date":"2026-10-28","chc_id":"CHC-2","zone_id":"Z05","machines":1,"ha":0.9},{"date":"2026-10-30","chc_id":"CHC-2","zone_id":"Z03","machines":1,"ha":2.2},{"date":"2026-10-30","chc_id":"CHC-3","zone_id":"Z09","machines":1,"ha":6.8},{"date":"2026-10-31","chc_id":"CHC-2","zone_id":"Z03","machines":1,"ha":1.3},{"date":"2026-10-31","chc_id":"CHC-2","zone_id":"Z04","machines":1,"ha":2.2},{"date":"2026-10-31","chc_id":"CHC-3","zone_id":"Z08","machines":1,"ha":7.9},{"date":"2026-11-01","chc_id":"CHC-3","zone_id":"Z08","machines":1,"ha":27.7}],"summary":{"ha_demand":520.3,"optimized":{"ha_served_in_window":520.3,"ha_missed_window":0.0,"pct_served":100.0,"machine_days":30,"travel_km":67.1},"baseline":{"ha_served_in_window":520.3,"ha_missed_window":0.0,"pct_served":100.0,"machine_days":45,"travel_km":101.3},"greedy":{"ha_served_in_window":520.3,"ha_missed_window":0.0,"pct_served":100.0,"machine_days":43,"travel_km":97.0},"milp":{"ha_served_in_window":520.3,"ha_missed_window":0.0,"pct_served":100.0,"machine_days":30,"travel_km":67.1},"method":"milp","solver":{"n_jobs":118,"n_jobs_merged":63,"n_int_vars":203,"n_cont_vars":1288,"time_limit_s":10.0,"status":"Optimization terminated successfully. (HiGHS Status 7: Optimal)","optimal":true,"solve_s":0.11,"n_constraints":550,"mip_gap":2.961821125902306e-07,"assign_status":"Optimization terminated successfully. (HiGHS Status 7: Optimal)","assign_s":0.001},"notes":"ha = machine-dependent area (field area x share_needing_chc). optimized = the plan above (milp); greedy = earliest-deadline-first heuristic, milp = exact solver (scipy/HiGHS), both pool CHCs within max_service_km and know demand in advance. Baseline = reactive booking: request after harvest + lag, nearest CHC only, first come first served. CHCs are simulated."}}